<?xml version="1.0" encoding="UTF-8" standalone="yes"?>
<table name="xtcasCASServices" xmlns:xsi="http://www.w3.org/2001/XMLSchema-instance" xsi:noNamespaceSchemaLocation="table.xsd">
<description><de>Hier werden die Dienste und dazugeh√∂rige Informationen abgespeichert.</de></description>
	<column name="KeyLong">
		<integer nullable="false" identity="true"/>
	</column>
	<column name="KeyText">
		<varchar length="50" nullable="false"/>
	</column>
	<column name="ServiceURL">
		<varchar length="250" nullable="false"/>
	</column>
	<column name="Port">
		<integer nullable="false"/>
	</column>
	<column name="LastUser" default="system_user">
		<varchar length="50" nullable="false"/>
	</column>
	<column name="LastDate" default="getdate()">
		<datetime nullable="false"/>
	</column>
	<column name="LastAction" default="1">
		<integer nullable="false"/>
	</column>
	<primarykey>
		<column>KeyLong</column>
	</primarykey>
	<uniquekey name="UQ_xtcasCASServices">
		<column>KeyText</column>
	</uniquekey>
</table>