<?xml version="1.0" encoding="UTF-8" standalone="yes"?>
<table name="xtcasLuUserPrivilegeUserGroup" xmlns:xsi="http://www.w3.org/2001/XMLSchema-instance" xsi:noNamespaceSchemaLocation="table.xsd">
	<column name="KeyLong">
		<integer nullable="false" identity="true"/>
	</column>
    <column name="KeyText">
        <varchar length="50" nullable="false"/>
    </column>
	<column name="UserPrivilegeKey">
		<integer nullable="false"/>
	</column>
	<column name="UserGroupKey">
		<integer nullable="false"/>
	</column>
	<column default="0" name="RowLevelSecurity">
		<boolean nullable="false"/>
	</column>
	<column name="LastUser" default="system_user">
		<varchar length="50" nullable="false"/>
	</column>
	<column name="LastDate" default="getdate()">
		<datetime nullable="false"/>
	</column>
	<column name="LastAction" default="1">
		<integer nullable="false"/>
	</column>
	<primarykey>
		<column>KeyLong</column>
	</primarykey>
	<foreignkey refid="UserPrivilegeKey" table="xtcasUserPrivilege"/>
	<foreignkey refid="UserGroupKey" table="xtcasUserGroup"/>
</table>