<?xml version="1.0" encoding="UTF-8" standalone="yes"?>
<table name="xtcasServiceMessage" xmlns:xsi="http://www.w3.org/2001/XMLSchema-instance" xsi:noNamespaceSchemaLocation="table.xsd">
	<description>
		<de> In dieser Tabelle werden die Nachrichten, welche an die verschiedenen Dienste geschickt werden sollen, zwischengespeichert.
		Sobald die Nachricht versandt wurde, wird sie auf isSent gesetzt.</de>
	</description>
	<column name="KeyLong">
		<integer nullable="false" identity="true"/>
	</column>
	<column name="CASServiceKey">
		<integer nullable="false"/>
	</column>
	<column name="Message">
		<varchar length="1024"/>
	</column>
	<column name="IsSent">
		<boolean nullable="false"/>
	</column>
	<column name="NumberOfAttempts" default="0">
		<integer nullable="false"/>
	</column>
	<column name="MessageCreationDate">
		<datetime nullable="false"/>
	</column>
	<column name="LastUser" default="system_user">
		<varchar length="50" nullable="false"/>
	</column>
	<column name="LastDate" default="getdate()">
		<datetime nullable="false"/>
	</column>
	<column name="LastAction" default="1">
		<integer nullable="false"/>
	</column>
	<column name="Failed" default="0">
		<boolean nullable="false"/>
	</column>
	<primarykey>
		<column>KeyLong</column>
	</primarykey>
	<foreignkey refid="CASServiceKey" table="xtcasCASServices"/>
</table>