<?xml version="1.0" encoding="UTF-8" standalone="yes"?>
<table name="xtcasColumnSecurity" xmlns:xsi="http://www.w3.org/2001/XMLSchema-instance" xsi:noNamespaceSchemaLocation="table.xsd">
	<column name="KeyLong">
		<integer nullable="false" identity="true"/>
	</column>
	<column name="KeyText">
		<varchar length="50" nullable="false"/>
	</column>
	<column name="TableName">
		<!-- längster Name bei uns: 47 -->
		<varchar length="50" nullable="false"/>
	</column>
	<column name="ColumnName">
		<!-- längster Name bei uns: 38 -->
		<varchar length="50" nullable="false"/>
	</column>
	<column name="SecurityToken">
		<varchar length="50" nullable="false"/>
	</column>
	<column name="LastUser" default="system_user">
		<varchar length="50" nullable="false"/>
	</column>
	<column name="LastDate" default="getdate()">
		<datetime nullable="false"/>
	</column>
	<column name="LastAction" default="1">
		<integer nullable="false"/>
	</column>
	<primarykey>
		<column>KeyLong</column>
	</primarykey>
</table>