<?xml version="1.0" encoding="UTF-8" standalone="yes"?>
<table name="xtcasMdi" xmlns:xsi="http://www.w3.org/2001/XMLSchema-instance" xsi:noNamespaceSchemaLocation="table.xsd">
	<column name="KeyLong">
		<integer nullable="false" identity="true"/>
	</column>
	<column name="KeyText">
		<varchar length="50" nullable="false"/>
	</column>
	<column name="ID">
		<varchar length="100" nullable="true"/>
	</column>
	<column name="Icon">
		<varchar length="100" nullable="true"/>
	</column>
	<column name="Label">
		<varchar length="100" nullable="true"/>
	</column>
	<column name="Menu">
		<varchar length="100" nullable="true"/>
	</column>
	<column name="Position">
		<float decimals="5" nullable="true"/>
	</column>
	<column name="MdiTypeKey">
		<integer nullable="false"/>
	</column>
	<column name="ModulName">
		<varchar length="500" nullable="false"/>
	</column>
	<column name="SecurityToken">
		<varchar length="50" nullable="true"/>
	</column>
	<column name="LastUser" default="system_user">
		<varchar length="50" nullable="false"/>
	</column>
	<column name="LastDate" default="getdate()">
		<datetime nullable="false"/>
	</column>
	<column name="LastAction" default="1">
		<integer nullable="false"/>
	</column>
	<primarykey>
		<column>KeyLong</column>
	</primarykey>
	<foreignkey refid="MdiTypeKey" table="xtcasMdiType"/>
</table>