<?xml version="1.0" encoding="UTF-8" standalone="yes"?>
<table name="xtcasAuthorities" xmlns:xsi="http://www.w3.org/2001/XMLSchema-instance" xsi:noNamespaceSchemaLocation="table.xsd">
	<column name="KeyLong">
		<integer nullable="false" identity="true"/>
	</column>
	<column name="Username">
		<varchar length="50" nullable="false"/>
	</column>
	<column name="Authority">
		<varchar length="50" nullable="false"/>
        <desc>Rolle/UserGruppe des Users. Kommt aus xtcasUserGroup.</desc>
	</column>
	<column default="user_name()" name="LastUser">
        <varchar length="50" nullable="true"/>
    </column>
    <column default="getdate()" name="LastDate">
        <datetime nullable="true"/>
    </column>
    <column default="1" name="LastAction">
        <integer nullable="true"/>
    </column>
	<primarykey>
		<column>KeyLong</column>
	</primarykey>
	<foreignkey refid="Username" table="xtcasUsers">
		<column name="KeyText" />
	</foreignkey>
	<foreignkey refid="Authority" table="xtcasUserGroup">
	<column name="KeyText" />
	</foreignkey>
</table>