<?xml version="1.0" encoding="UTF-8" standalone="yes"?>
<table name="xtcasServiceProperties" xmlns:xsi="http://www.w3.org/2001/XMLSchema-instance" xsi:noNamespaceSchemaLocation="table.xsd">
	<column name="KeyLong">
		<integer nullable="false" identity="true"/>
	</column>
	<column name="Service">
		<varchar length="128" nullable="false"/>
	</column>
	<column name="KeyText">
		<varchar length="50" nullable="true"/>
	</column>
	<column name="Property">
		<varchar length="256" nullable="false"/>
	</column>
	<column name="Val">
		<varchar length="1024" nullable="false"/>
	</column>
	<column default="user_name()" name="LastUser">
        <varchar length="50" nullable="true"/>
    </column>
    <column default="getdate()" name="LastDate">
        <datetime nullable="true"/>
    </column>
    <column default="1" name="LastAction">
        <integer nullable="true"/>
    </column>
	<primarykey>
		<column>KeyLong</column>
	</primarykey>
	<uniquekey name="">
		<column>Service</column>
        <column>Property</column>
    </uniquekey>
</table>