<?xml version="1.0" encoding="UTF-8" standalone="yes"?>
<table name="xtcasProcedureNewsfeed" xmlns:xsi="http://www.w3.org/2001/XMLSchema-instance" xsi:noNamespaceSchemaLocation="table.xsd">
	<description><de>In dieser Tabelle wird hinterlegt, welche Prozeduren Änderungen an Topics bewirken bzw. einen Trigger herbeiführen.</de></description>
	<column name="KeyLong">
		<integer nullable="false" identity="true"/>
	</column>
	<column name="KeyText">
		<varchar length="50" nullable="true"/>
	</column>
	<column name="Topic">
		<varchar length="50" nullable="false"/>
	</column>
	<column name="LastUser" default="system_user">
		<varchar length="50" nullable="false"/>
	</column>
	<column name="LastDate" default="getdate()">
		<datetime nullable="false"/>
	</column>
	<column name="LastAction" default="1">
		<integer nullable="false"/>
	</column>
	<primarykey>
		<column>KeyLong</column>
	</primarykey>
</table>